{
  "id": "insert.line",
  "version": 1,
  "status": "verified",
  "surface": "insert",
  "title": "插入线条",
  "kimiUi": {
    "controlLabel": "插入线条",
    "location": "插入更多菜单",
    "appearsWhen": "editor"
  },
  "preconditions": {
    "fixtureId": "syn-empty",
    "pageIndex": 0,
    "selection": {
      "kind": "none"
    }
  },
  "action": {
    "type": "click",
    "steps": [
      "插入线条"
    ]
  },
  "evidence": {
    "screenshots": {
      "before": "shots/before.png",
      "after": "shots/after.png"
    },
    "pptd": {
      "summary": "native session mutates PPTD"
    }
  },
  "test": {
    "id": "EO-INSERT-LINE"
  },
  "oracle": {
    "source": "kimi-iframe",
    "capturedAt": "2026-08-14T20:00:00.000Z",
    "agent": "s3-s13"
  },
  "updatedAt": "2026-08-14T20:00:00.000Z"
}
