{
  "id": "element.chart.type.set",
  "version": 1,
  "status": "verified",
  "surface": "element.chart",
  "title": "图表类型",
  "kimiUi": {
    "controlLabel": "图表类型",
    "location": "图表工具条",
    "appearsWhen": "editor"
  },
  "preconditions": {
    "fixtureId": "syn-empty",
    "pageIndex": 0,
    "selection": {
      "kind": "none"
    }
  },
  "action": {
    "type": "click",
    "steps": [
      "图表类型"
    ]
  },
  "evidence": {
    "screenshots": {
      "before": "shots/before.png",
      "after": "shots/after.png"
    },
    "pptd": {
      "summary": "native session mutates PPTD"
    }
  },
  "test": {
    "id": "EO-ELEMENT-CHART-TYPE-SET"
  },
  "oracle": {
    "source": "kimi-iframe",
    "capturedAt": "2026-08-14T20:00:00.000Z",
    "agent": "s3-s13"
  },
  "updatedAt": "2026-08-14T20:00:00.000Z"
}
