{
  "version": 1,
  "preconditions": {
    "fixtureId": "okp-yu7-ppt",
    "pageIndex": 0,
    "selection": {
      "kind": "none"
    }
  },
  "action": {
    "type": "click",
    "steps": [
      "Click the control in official neo-ppt iframe"
    ]
  },
  "evidence": {
    "screenshots": {
      "before": "shots/before.png",
      "after": "shots/after.png"
    },
    "pptd": {
      "summary": "UI chrome; document change only if mustChangeDocument"
    }
  },
  "oracle": {
    "source": "kimi-iframe",
    "capturedAt": "2026-08-14T12:00:00.000Z",
    "agent": "oracle-compare-s1-discover",
    "sessionId": "iframe-compare-2026-08-14"
  },
  "updatedAt": "2026-08-14T12:00:00.000Z",
  "id": "chrome.pages.duplicate",
  "status": "verified",
  "surface": "chrome.pages",
  "title": "复制页面",
  "kimiUi": {
    "controlLabel": "复制页",
    "location": "page rail context",
    "appearsWhen": "page selected"
  },
  "expectedNative": {
    "mustChangeDocument": true,
    "commandHint": "duplicatePage"
  },
  "test": {
    "id": "EO-PAGE-003"
  }
}
